[
  {
    "id": "init-fresh-clean",
    "stageOrCutPoint": "fresh initialization completes every file and directory barrier",
    "artifactImage": "C=1, empty journal, W=(1,1)",
    "profileObservation": "exact linux-x86_64-gnu-ext4-local-v1 qualification",
    "triggeringOperationCode": null,
    "laterReaderCode": null,
    "laterReaderDisposition": "known_absent",
    "writerMutationPermitted": true,
    "unchangedArtifactAssertion": "Only the exact initialization artifacts and their durability state may change."
  },
  {
    "id": "init-pre-marker-partial",
    "stageOrCutPoint": "initialization stops before durable publication of C=1",
    "artifactImage": "one or more pre-marker reserved artifacts without a durable v2 commit marker",
    "profileObservation": "qualified before attempted creation",
    "triggeringOperationCode": "JOURNAL_UNAVAILABLE",
    "laterReaderCode": "JOURNAL_UNAVAILABLE",
    "laterReaderDisposition": "unavailable",
    "writerMutationPermitted": false,
    "unchangedArtifactAssertion": "The v2 writer does not adopt, repair, or complete a pre-marker partial directory."
  },
  {
    "id": "init-commit-marker-no-witness",
    "stageOrCutPoint": "C=1 is durable and the empty journal is exact, but the witness is absent",
    "artifactImage": "C=1, empty journal, no workflow.publish.json",
    "profileObservation": "exact supported profile",
    "triggeringOperationCode": "JOURNAL_UNAVAILABLE",
    "laterReaderCode": "JOURNAL_UNAVAILABLE",
    "laterReaderDisposition": "unavailable",
    "writerMutationPermitted": true,
    "unchangedArtifactAssertion": "Only the exclusive writer may create and barrier W=(1,0), revalidate it, and then write CLEAN."
  },
  {
    "id": "init-prepared-rebarrier-success",
    "stageOrCutPoint": "exclusive reopen of exact W=(1,0) completes the mandatory rebarrier",
    "artifactImage": "C=1, empty journal, exact W=(1,0), then W=(1,1)",
    "profileObservation": "same opened mount and artifact identities before CLEAN",
    "triggeringOperationCode": null,
    "laterReaderCode": null,
    "laterReaderDisposition": "known_absent",
    "writerMutationPermitted": true,
    "unchangedArtifactAssertion": "Commit and journal remain byte-for-byte unchanged while only the witness becomes CLEAN."
  },
  {
    "id": "init-prepared-file-sync-dir-sync-failure-same-boot",
    "stageOrCutPoint": "W=(1,0) file sync succeeds, state-directory sync fails, and a same-boot reopen sees the file",
    "artifactImage": "C=1, empty journal, visible W=(1,0) with unproven namespace durability",
    "profileObservation": "supported profile remains visible but past directory durability is not inferred",
    "triggeringOperationCode": "JOURNAL_UNAVAILABLE",
    "laterReaderCode": "JOURNAL_UNAVAILABLE",
    "laterReaderDisposition": "unavailable",
    "writerMutationPermitted": true,
    "unchangedArtifactAssertion": "CLEAN is forbidden until a new witness sync, directory sync, and identity/content revalidation succeed."
  },
  {
    "id": "init-prepared-rebarrier-inode-replaced",
    "stageOrCutPoint": "witness path identity changes between rebarrier and CLEAN",
    "artifactImage": "C=1, empty journal, replaced W=(1,0) path or inode",
    "profileObservation": "artifact identity revalidation fails",
    "triggeringOperationCode": "JOURNAL_UNAVAILABLE",
    "laterReaderCode": "JOURNAL_UNAVAILABLE",
    "laterReaderDisposition": "unavailable",
    "writerMutationPermitted": false,
    "unchangedArtifactAssertion": "No CLEAN write, journal append, commit rewrite, repair, or replacement is permitted."
  },
  {
    "id": "init-clean-final-sync-failure-visible",
    "stageOrCutPoint": "final W=(1,1) becomes visible after all prerequisite barriers but its own sync reports failure",
    "artifactImage": "C=1, empty journal, visible exact W=(1,1)",
    "profileObservation": "all prerequisite profile and artifact checks passed",
    "triggeringOperationCode": "JOURNAL_UNAVAILABLE",
    "laterReaderCode": null,
    "laterReaderDisposition": "known_absent",
    "writerMutationPermitted": false,
    "unchangedArtifactAssertion": "The triggering operation stops; a later reader may use the fully revalidated CLEAN image."
  },
  {
    "id": "init-clean-missing-commit",
    "stageOrCutPoint": "reader observes CLEAN witness without the required commit marker",
    "artifactImage": "empty journal, W=(1,1), missing workflow.commit.json",
    "profileObservation": "supported profile",
    "triggeringOperationCode": "JOURNAL_UNAVAILABLE",
    "laterReaderCode": "JOURNAL_UNAVAILABLE",
    "laterReaderDisposition": "unavailable",
    "writerMutationPermitted": false,
    "unchangedArtifactAssertion": "Reader and writer leave every visible artifact unchanged."
  },
  {
    "id": "init-prepared-nonempty-journal",
    "stageOrCutPoint": "initialization image contains journal bytes",
    "artifactImage": "C=1, W=(1,0), non-empty journal",
    "profileObservation": "supported profile",
    "triggeringOperationCode": "JOURNAL_CORRUPT",
    "laterReaderCode": "JOURNAL_CORRUPT",
    "laterReaderDisposition": "corrupt",
    "writerMutationPermitted": false,
    "unchangedArtifactAssertion": "The non-empty image is not adopted, truncated, promoted, or cleaned."
  },
  {
    "id": "init-v1-commit",
    "stageOrCutPoint": "version probe sees the historical v1 commit document",
    "artifactImage": "storeVersion=1 commit with no v2 witness",
    "profileObservation": "supported profile",
    "triggeringOperationCode": "JOURNAL_SCHEMA_UNSUPPORTED",
    "laterReaderCode": "JOURNAL_SCHEMA_UNSUPPORTED",
    "laterReaderDisposition": "schema_unsupported",
    "writerMutationPermitted": false,
    "unchangedArtifactAssertion": "The v1 state is never overwritten, adopted, or migrated."
  },
  {
    "id": "init-unknown-version",
    "stageOrCutPoint": "version probe sees an unsupported store version",
    "artifactImage": "well-formed commit envelope with an unsupported storeVersion",
    "profileObservation": "supported profile",
    "triggeringOperationCode": "JOURNAL_SCHEMA_UNSUPPORTED",
    "laterReaderCode": "JOURNAL_SCHEMA_UNSUPPORTED",
    "laterReaderDisposition": "schema_unsupported",
    "writerMutationPermitted": false,
    "unchangedArtifactAssertion": "No reserved artifact changes."
  },
  {
    "id": "init-malformed-witness",
    "stageOrCutPoint": "witness decode or closed-shape validation fails",
    "artifactImage": "C=1, empty journal, malformed or contradictory workflow.publish.json",
    "profileObservation": "supported profile",
    "triggeringOperationCode": "JOURNAL_CORRUPT",
    "laterReaderCode": "JOURNAL_CORRUPT",
    "laterReaderDisposition": "corrupt",
    "writerMutationPermitted": false,
    "unchangedArtifactAssertion": "Malformed bytes are not repaired or replaced."
  },
  {
    "id": "append-clean-generation",
    "stageOrCutPoint": "reader or writer opens a completely revalidated clean generation G",
    "artifactImage": "W=(G,G), C=G, exact journal generation G",
    "profileObservation": "supported profile and all artifact identities match",
    "triggeringOperationCode": null,
    "laterReaderCode": null,
    "laterReaderDisposition": "known_from_exact_prefix",
    "writerMutationPermitted": true,
    "unchangedArtifactAssertion": "No mutation occurs until the writer begins the next PREPARED transition."
  },
  {
    "id": "append-prepared-old-commit-old-journal",
    "stageOrCutPoint": "durable PREPARED precedes the first journal byte",
    "artifactImage": "W=(G+1,G), C=G, exact old journal G",
    "profileObservation": "supported profile",
    "triggeringOperationCode": "JOURNAL_OUTCOME_UNKNOWN",
    "laterReaderCode": "JOURNAL_OUTCOME_UNKNOWN",
    "laterReaderDisposition": "unknown",
    "writerMutationPermitted": false,
    "unchangedArtifactAssertion": "Reopen performs no rollback, CLEAN rewrite, append, or repair."
  },
  {
    "id": "append-prepared-old-commit-partial-journal",
    "stageOrCutPoint": "journal write started but the next record is partial",
    "artifactImage": "W=(G+1,G), C=G, old prefix plus partial bytes",
    "profileObservation": "supported profile",
    "triggeringOperationCode": "JOURNAL_OUTCOME_UNKNOWN",
    "laterReaderCode": "JOURNAL_OUTCOME_UNKNOWN",
    "laterReaderDisposition": "unknown",
    "writerMutationPermitted": false,
    "unchangedArtifactAssertion": "Partial bytes are not truncated or promoted."
  },
  {
    "id": "append-prepared-old-commit-new-journal",
    "stageOrCutPoint": "journal barrier completed before commit publication",
    "artifactImage": "W=(G+1,G), C=G, exact journal generation G+1",
    "profileObservation": "supported profile",
    "triggeringOperationCode": "JOURNAL_OUTCOME_UNKNOWN",
    "laterReaderCode": "JOURNAL_OUTCOME_UNKNOWN",
    "laterReaderDisposition": "unknown",
    "writerMutationPermitted": false,
    "unchangedArtifactAssertion": "The complete unpublished record is neither promoted nor retried."
  },
  {
    "id": "append-prepared-new-commit-new-journal",
    "stageOrCutPoint": "commit rename is visible but the state-directory barrier has not completed",
    "artifactImage": "durable W=(G+1,G), durable exact journal generation G+1, durable commit temporary file, visible renamed C=G+1, directory barrier pending or failed",
    "profileObservation": "supported profile",
    "triggeringOperationCode": "JOURNAL_OUTCOME_UNKNOWN",
    "laterReaderCode": "JOURNAL_OUTCOME_UNKNOWN",
    "laterReaderDisposition": "unknown",
    "writerMutationPermitted": false,
    "unchangedArtifactAssertion": "Directory-barrier failure forbids CLEAN, and a reader never returns a known result from this image."
  },
  {
    "id": "append-clean-tail",
    "stageOrCutPoint": "clean metadata names a shorter prefix than the physical journal",
    "artifactImage": "W=(G,G), C=G, valid prefix plus extra tail bytes",
    "profileObservation": "supported profile",
    "triggeringOperationCode": "JOURNAL_OUTCOME_UNKNOWN",